[
  {
    "activation_mode": "immediate",
    "band": "frontier",
    "control_mode": "codex_supervised",
    "delegate_tier": "executor",
    "difficulty": "d2_slice",
    "fallback_tier": "verifier",
    "id": "AOA-EV-Q-0001",
    "public_safe": true,
    "repo": "aoa-evals",
    "requires_artifacts": [
      "bounded_plan",
      "work_result",
      "verification_result"
    ],
    "risk": "r1_repo_local",
    "schema_version": "quest_dispatch_v1",
    "source_path": "quests/questbook/done/AOA-EV-Q-0001.yaml",
    "split_required": false,
    "state": "done",
    "wrapper_class": "local_patcher",
    "write_scope": "repo_local"
  },
  {
    "activation_mode": "on_review_of",
    "band": "frontier",
    "control_mode": "codex_supervised",
    "delegate_tier": "planner",
    "difficulty": "d2_slice",
    "fallback_tier": "verifier",
    "id": "AOA-EV-Q-0002",
    "public_safe": true,
    "repo": "aoa-evals",
    "requires_artifacts": [
      "bounded_plan",
      "evaluation_result",
      "verification_result"
    ],
    "risk": "r1_repo_local",
    "schema_version": "quest_dispatch_v1",
    "source_path": "quests/proof/done/AOA-EV-Q-0002.yaml",
    "split_required": false,
    "state": "done",
    "wrapper_class": "codex_primary",
    "write_scope": "docs_only"
  },
  {
    "activation_mode": "on_review_of",
    "band": "near",
    "control_mode": "human_codex_copilot",
    "delegate_tier": "planner",
    "difficulty": "d3_seam",
    "fallback_tier": "verifier",
    "id": "AOA-EV-Q-0003",
    "public_safe": true,
    "repo": "aoa-evals",
    "requires_artifacts": [
      "bounded_plan",
      "work_result",
      "verification_result"
    ],
    "risk": "r2_contract",
    "schema_version": "quest_dispatch_v1",
    "source_path": "quests/trace/captured/AOA-EV-Q-0003.yaml",
    "split_required": true,
    "state": "captured",
    "wrapper_class": "hybrid",
    "write_scope": "repo_local"
  },
  {
    "activation_mode": "on_recurrence",
    "band": "latent",
    "control_mode": "codex_supervised",
    "delegate_tier": "planner",
    "difficulty": "d2_slice",
    "fallback_tier": "verifier",
    "id": "AOA-EV-Q-0004",
    "public_safe": true,
    "repo": "aoa-evals",
    "requires_artifacts": [
      "recurrence_evidence",
      "promotion_decision"
    ],
    "risk": "r1_repo_local",
    "schema_version": "quest_dispatch_v1",
    "source_path": "quests/harvest/captured/AOA-EV-Q-0004.yaml",
    "split_required": false,
    "state": "captured",
    "wrapper_class": "codex_primary",
    "write_scope": "docs_only"
  },
  {
    "activation_mode": "manual",
    "band": "frontier",
    "control_mode": "human_codex_copilot",
    "delegate_tier": "planner",
    "difficulty": "d3_seam",
    "fallback_tier": "verifier",
    "id": "AOA-EV-Q-0005",
    "public_safe": true,
    "repo": "aoa-evals",
    "requires_artifacts": [
      "bounded_plan",
      "work_result",
      "verification_result"
    ],
    "risk": "r2_contract",
    "schema_version": "quest_dispatch_v1",
    "source_path": "quests/proof/captured/AOA-EV-Q-0005.yaml",
    "split_required": true,
    "state": "captured",
    "wrapper_class": "hybrid",
    "write_scope": "repo_local"
  },
  {
    "activation_mode": "manual",
    "band": "frontier",
    "capability_target": "repo_layer_selection",
    "control_mode": "human_codex_copilot",
    "delegate_tier": "planner",
    "difficulty": "d2_slice",
    "fallback_tier": "verifier",
    "id": "AOA-EV-Q-0006",
    "orchestrator_class_ref": "aoa-agents:router",
    "public_safe": true,
    "repo": "aoa-evals",
    "requires_artifacts": [
      "bounded_plan",
      "work_result",
      "verification_result"
    ],
    "risk": "r1_repo_local",
    "schema_version": "quest_dispatch_v1",
    "source_path": "quests/orchestrator/captured/AOA-EV-Q-0006.yaml",
    "split_required": false,
    "state": "captured",
    "wrapper_class": "hybrid",
    "write_scope": "docs_only"
  },
  {
    "activation_mode": "manual",
    "band": "frontier",
    "capability_target": "evidence_closure",
    "control_mode": "human_codex_copilot",
    "delegate_tier": "verifier",
    "difficulty": "d2_slice",
    "fallback_tier": "planner",
    "id": "AOA-EV-Q-0007",
    "orchestrator_class_ref": "aoa-agents:review",
    "public_safe": true,
    "repo": "aoa-evals",
    "requires_artifacts": [
      "bounded_plan",
      "work_result",
      "verification_result"
    ],
    "risk": "r1_repo_local",
    "schema_version": "quest_dispatch_v1",
    "source_path": "quests/orchestrator/captured/AOA-EV-Q-0007.yaml",
    "split_required": false,
    "state": "captured",
    "wrapper_class": "hybrid",
    "write_scope": "docs_only"
  },
  {
    "activation_mode": "manual",
    "band": "frontier",
    "capability_target": "bounded_next_step",
    "control_mode": "human_codex_copilot",
    "delegate_tier": "planner",
    "difficulty": "d2_slice",
    "fallback_tier": "verifier",
    "id": "AOA-EV-Q-0008",
    "orchestrator_class_ref": "aoa-agents:bounded_execution",
    "public_safe": true,
    "repo": "aoa-evals",
    "requires_artifacts": [
      "bounded_plan",
      "work_result",
      "verification_result"
    ],
    "risk": "r1_repo_local",
    "schema_version": "quest_dispatch_v1",
    "source_path": "quests/orchestrator/captured/AOA-EV-Q-0008.yaml",
    "split_required": false,
    "state": "captured",
    "wrapper_class": "hybrid",
    "write_scope": "docs_only"
  },
  {
    "activation_mode": "manual",
    "band": "frontier",
    "control_mode": "human_codex_copilot",
    "delegate_tier": "planner",
    "difficulty": "d3_seam",
    "fallback_tier": "verifier",
    "id": "AOA-EV-Q-0009",
    "public_safe": true,
    "repo": "aoa-evals",
    "requires_artifacts": [
      "bounded_plan",
      "work_result",
      "verification_result"
    ],
    "risk": "r2_contract",
    "schema_version": "quest_dispatch_v1",
    "source_path": "quests/unlock/triaged/AOA-EV-Q-0009.yaml",
    "split_required": false,
    "state": "triaged",
    "wrapper_class": "codex_primary",
    "write_scope": "repo_local"
  },
  {
    "activation_mode": "on_review_of",
    "band": "latent",
    "control_mode": "human_codex_copilot",
    "delegate_tier": "verifier",
    "difficulty": "d2_slice",
    "fallback_tier": "planner",
    "id": "AOA-EV-Q-0010",
    "public_safe": true,
    "repo": "aoa-evals",
    "requires_artifacts": [
      "bounded_plan",
      "work_result",
      "verification_result"
    ],
    "risk": "r2_contract",
    "schema_version": "quest_dispatch_v1",
    "source_path": "quests/closeout/captured/AOA-EV-Q-0010.yaml",
    "split_required": false,
    "state": "captured",
    "wrapper_class": "codex_primary",
    "write_scope": "repo_local"
  },
  {
    "activation_mode": "on_review_of",
    "band": "latent",
    "control_mode": "human_codex_copilot",
    "delegate_tier": "verifier",
    "difficulty": "d2_slice",
    "fallback_tier": "planner",
    "id": "AOA-EV-Q-0011",
    "public_safe": true,
    "repo": "aoa-evals",
    "requires_artifacts": [
      "bounded_plan",
      "work_result",
      "verification_result"
    ],
    "risk": "r2_contract",
    "schema_version": "quest_dispatch_v1",
    "source_path": "quests/trace/captured/AOA-EV-Q-0011.yaml",
    "split_required": false,
    "state": "captured",
    "wrapper_class": "codex_primary",
    "write_scope": "repo_local"
  },
  {
    "activation_mode": "on_review_of",
    "band": "latent",
    "control_mode": "human_codex_copilot",
    "delegate_tier": "verifier",
    "difficulty": "d2_slice",
    "fallback_tier": "planner",
    "id": "AOA-EV-Q-0012",
    "public_safe": true,
    "repo": "aoa-evals",
    "requires_artifacts": [
      "bounded_plan",
      "work_result",
      "verification_result"
    ],
    "risk": "r2_contract",
    "schema_version": "quest_dispatch_v1",
    "source_path": "quests/trace/captured/AOA-EV-Q-0012.yaml",
    "split_required": false,
    "state": "captured",
    "wrapper_class": "codex_primary",
    "write_scope": "repo_local"
  },
  {
    "activation_mode": "on_review_of",
    "band": "latent",
    "control_mode": "human_codex_copilot",
    "delegate_tier": "verifier",
    "difficulty": "d2_slice",
    "fallback_tier": "planner",
    "id": "AOA-EV-Q-0013",
    "public_safe": true,
    "repo": "aoa-evals",
    "requires_artifacts": [
      "bounded_plan",
      "work_result",
      "verification_result"
    ],
    "risk": "r2_contract",
    "schema_version": "quest_dispatch_v1",
    "source_path": "quests/closeout/captured/AOA-EV-Q-0013.yaml",
    "split_required": false,
    "state": "captured",
    "wrapper_class": "codex_primary",
    "write_scope": "repo_local"
  }
]
